created_at,date,user_id,username,name,tweet,link,POS tagged,Label
1658223619000.0,2022-07-19 16:40:19,1444353323264462848,SlametKasan,Slamet Suhandoko Kasan Widjoyo,    virus covid    sars h n  h n   berawal dari negara china tiongkok semuanya itu berasal,https://twitter.com/SlametKasan/status/1549328268863881217,"[('virus', 'n'), ('covid', 'n'), ('sars', 'n'), ('h', 'v'), ('n', None), ('h', 'n'), ('n', None), ('negara', None), ('china', 'n'), ('tiongkok', 'n'), ('berasal', 'n')]",FAKTA
1657625273000.0,2022-07-12 18:27:53,1488712320495009792,SekuritasBahana,Bahana Sekuritas,pandemi covid    memang berasal dari china dan kini kembali merebak di china  terkait covid     pemerintah china punya langkah tegas dalam menangani wabah lewat kebijakan nol covid ,https://twitter.com/SekuritasBahana/status/1546818626220539906,"[('pandemi', 'n'), ('covid', 'n'), ('berasal', 'n'), ('china', 'n'), ('merebak', 'n'), ('china', 'n'), ('terkait', 'n'), ('covid', 'n'), ('pemerintah', 'n'), ('china', 'n'), ('langkah', 'n'), ('menangani', 'n'), ('wabah', 'n'), ('kebijakan', 'n'), ('nol', 'n'), ('covid', 'n')]",FAKTA
1657012560000.0,2022-07-05 16:16:00,241936971,FitRadioBandung,94.8 FM FIT Radio Bandung,mui mengeluarkan fatwa menetapkan vaksin covid    buatan cansino china  convidecia  adalah haram   hal ini dikarenakan dalam proses produksi vaksin cansino ternyata memanfaatkan bagian tubuh manusia  yaitu sel yg berasal dari ginjal embrio bayi manusia   staysafe stayfitforlife  ,https://twitter.com/FitRadioBandung/status/1544248719939362821,"[('mui', 'n'), ('mengeluarkan', 'n'), ('fatwa', 'n'), ('menetapkan', 'n'), ('vaksin', 'n'), ('covid', 'n'), ('buatan', 'n'), ('cansino', 'n'), ('china', 'n'), ('convidecia', 'n'), ('haram', 'n'), ('proses', 'v'), ('produksi', None), ('vaksin', 'n'), ('cansino', 'n'), ('memanfaatkan', 'n'), ('tubuh', 'n'), ('manusia', 'n'), ('sel', 'n'), ('yg', 'n'), ('berasal', 'n'), ('ginjal', None), ('embrio', 'n'), ('bayi', 'n'), ('manusia', 'n'), ('staysafe', None), ('stayfitforlife', 'n')]",FAKTA
1656701475000.0,2022-07-02 01:51:15,980097559736721408,AlbertSolo2,Albert Solo,badan kesehatan dunia who hingga saat ini masih melakukan penyelidikan terkait dari mana asal muasal virus corona atau covid    tersebut berasal  selama ini  sejumlah negara barat seperti amerika serikat dan uni eropa menuduh china adalah negara asal covid    tersebut ,https://twitter.com/AlbertSolo2/status/1542943936640978944,"[('badan', 'n'), ('kesehatan', 'n'), ('dunia', 'n'), ('who', None), ('penyelidikan', None), ('terkait', 'n'), ('muasal', 'n'), ('virus', 'n'), ('corona', 'n'), ('covid', 'n'), ('berasal', 'n'), ('negara', None), ('barat', 'n'), ('amerika', None), ('serikat', None), ('uni', None), ('eropa', 'n'), ('menuduh', 'n'), ('china', 'n'), ('negara', 'n'), ('covid', 'n')]",FAKTA
1656480507000.0,2022-06-29 12:28:27,1385409536148729858,OmegaF1998,Omega1998,   tka aseng yang berasal dari china awal mula covid  didatangkan lalu rakyat difitnah sebagai penyebar covid  migor langka  rakyat yang difitnah sebagai biang kelangkaan migor bukadraftrkuhp  bukadraftrkuhp,https://twitter.com/OmegaF1998/status/1542017129725427712,"[('tka', 'n'), ('aseng', 'n'), ('berasal', 'n'), ('china', 'n'), ('covid', 'n'), ('rakyat', 'n'), ('difitnah', 'n'), ('penyebar', 'n'), ('covid', 'n'), ('migor', 'n'), ('langka', 'n'), ('rakyat', 'n'), ('difitnah', 'n'), ('biang', 'n'), ('kelangkaan', 'v'), ('migor', None), ('bukadraftrkuhp', 'n'), ('bukadraftrkuhp', 'n')]",FAKTA
1656151930000.0,2022-06-25 17:12:10,980097559736721408,AlbertSolo2,Albert Solo,kasus harian covid    di wilayah khusus makau china kembali melonjak akibatnya pemerintah negara bekas protektorat portugal tersebut kembali menutup semua bisnis kecuali rumah judi di negara tersebut penghasilan utama makau china memang berasal dari pajak rumah judi ,https://twitter.com/AlbertSolo2/status/1540638977702895617,"[('harian', None), ('covid', 'n'), ('wilayah', 'n'), ('khusus', 'n'), ('makau', None), ('china', 'n'), ('melonjak', 'n'), ('akibatnya', 'n'), ('pemerintah', 'n'), ('negara', 'n'), ('bekas', 'n'), ('protektorat', 'n'), ('portugal', 'n'), ('menutup', None), ('bisnis', 'n'), ('kecuali', 'n'), ('rumah', 'n'), ('judi', 'n'), ('negara', 'n'), ('penghasilan', 'n'), ('utama', None), ('makau', 'n'), ('china', 'n'), ('berasal', 'n'), ('pajak', None), ('rumah', 'n'), ('judi', 'n')]",FAKTA
1655447199000.0,2022-06-17 13:26:39,980097559736721408,AlbertSolo2,Albert Solo,antisipasi masuknya virus omicron yang berasal dari luar korea utara  pemerintah korea utara larang keras warga negara asing  masuk ke wilayah mereka  termasuk turis asal china dan russia  yang merupakan sekutu terdekat korea utara  sejak dulu korea utara darurat covid   ,https://twitter.com/AlbertSolo2/status/1537683121688104960,"[('antisipasi', 'n'), ('masuknya', 'n'), ('virus', 'n'), ('omicron', 'n'), ('berasal', 'n'), ('korea', 'n'), ('utara', None), ('pemerintah', 'n'), ('korea', 'n'), ('utara', 'n'), ('larang', 'n'), ('keras', None), ('warga', 'n'), ('negara', None), ('asing', 'v'), ('masuk', 'n'), ('wilayah', 'n'), ('turis', 'n'), ('china', None), ('russia', 'n'), ('sekutu', 'n'), ('terdekat', 'n'), ('korea', 'n'), ('utara', None), ('korea', 'n'), ('utara', None), ('darurat', 'n'), ('covid', 'n')]",FAKTA
1654384829000.0,2022-06-05 06:20:29,459817858,mawardinurullah,HIPOTESIS,neocov disebut sebut sebagai varian baru dari covid    usai era omicron  varian ini dilaporkan berasal dari china  apakah kejang  berdarah yg akhir  ini melanda china berasal dr neocov ,https://twitter.com/mawardinurullah/status/1533227217995845632,"[('neocov', 'r'), ('varian', None), ('covid', 'n'), ('era', 'n'), ('omicron', 'n'), ('varian', None), ('dilaporkan', 'n'), ('berasal', 'n'), ('china', 'n'), ('kejang', 'n'), ('berdarah', 'n'), ('yg', 'n'), ('melanda', 'n'), ('china', 'n'), ('berasal', 'n'), ('dr', 'n'), ('neocov', 'n')]",FAKTA
1651067598000.0,2022-04-27 20:53:18,1450764175341277187,hazelhartley_,Azel,ni virus namanya covid soalnya berasal dari china  kalo dari bandung namanya jadi kangvid ,https://twitter.com/hazelhartley_/status/1519313743838330881,"[('ni', None), ('virus', 'n'), ('namanya', 'n'), ('covid', 'n'), ('berasal', 'n'), ('china', 'n'), ('kalo', 'n'), ('bandung', 'n'), ('namanya', None), ('kangvid', 'n')]",FAKTA
1650765607000.0,2022-04-24 09:00:07,1298198664100212736,GoodDoggo107,Good Doggo,covid     tiongkok daratan  mainland china  melaporkan    kasus kematian harian covid     semua berasal dari shanghai  ini merupakan peningkatan kematian harian terbesar sejak wabah wuhan      lalu  kasus harian bergejala berada di        terendah dalam   minggu terakhir ,https://twitter.com/GoodDoggo107/status/1518047101741010944,"[('covid', 'n'), ('tiongkok', 'n'), ('daratan', None), ('mainland', 'n'), ('china', 'n'), ('melaporkan', None), ('kematian', None), ('harian', 'n'), ('covid', 'n'), ('berasal', 'n'), ('shanghai', None), ('peningkatan', 'n'), ('kematian', None), ('harian', None), ('terbesar', 'n'), ('wabah', 'n'), ('wuhan', 'n'), ('harian', None), ('bergejala', 'n'), ('terendah', 'n'), ('minggu', 'n')]",FAKTA
1649225105000.0,2022-04-06 13:05:05,1410216249317937154,OmuraSumitada,Praetorium,walau  diduga  covid berasal dari china akibat kelalaian laboratorium senjata kimia  dan china mampu membuat vaksin     but  actually it s not working at all        ,https://twitter.com/OmuraSumitada/status/1511585766434308096,"[('diduga', 'n'), ('covid', 'n'), ('berasal', 'n'), ('china', 'n'), ('akibat', 'n'), ('kelalaian', None), ('laboratorium', 'n'), ('senjata', 'n'), ('kimia', 'n'), ('china', 'n'), ('vaksin', 'n'), ('but', None), ('actually', 'r'), ('it', None), ('s', 'v'), ('not', 'r'), ('working', 'v'), ('at', None), ('all', None)]",FAKTA
1649225025000.0,2022-04-06 13:03:45,1412297318385164308,SumitadaOmura,Sacerdotum,walau  diduga  covid berasal dari china akibat kelalaian laboratorium senjata kimia  dan china mampu membuat vaksin     but  actually it s not working at all        ,https://twitter.com/SumitadaOmura/status/1511585430999007233,"[('diduga', 'n'), ('covid', 'n'), ('berasal', 'n'), ('china', 'n'), ('akibat', 'n'), ('kelalaian', None), ('laboratorium', 'n'), ('senjata', 'n'), ('kimia', 'n'), ('china', 'n'), ('vaksin', 'n'), ('but', None), ('actually', 'r'), ('it', None), ('s', 'v'), ('not', 'r'), ('working', 'v'), ('at', None), ('all', None)]",FAKTA
1649224883000.0,2022-04-06 13:01:23,709568803768631296,LangkirKliwon,Langkir Kliwon,walau  diduga  covid berasal dari china akibat kelalaian laboratorium senjata kimia  dan china mampu membuat vaksin     but  actually it s not working at all        ,https://twitter.com/LangkirKliwon/status/1511584834266693637,"[('diduga', 'n'), ('covid', 'n'), ('berasal', 'n'), ('china', 'n'), ('akibat', 'n'), ('kelalaian', None), ('laboratorium', 'n'), ('senjata', 'n'), ('kimia', 'n'), ('china', 'n'), ('vaksin', 'n'), ('but', None), ('actually', 'r'), ('it', None), ('s', 'v'), ('not', 'r'), ('working', 'v'), ('at', None), ('all', None)]",FAKTA
1648555534000.0,2022-03-29 19:05:34,745100137203015681,daenpiliang,merdekabangsaku,covid    bukan berasal dari china tapi dari ukraine   ,https://twitter.com/daenpiliang/status/1508777384270450691,"[('covid', 'n'), ('berasal', 'n'), ('china', 'n'), ('ukraine', 'n')]",FAKTA
1648516952000.0,2022-03-29 08:22:32,1298198664100212736,GoodDoggo107,Good Doggo,tiongkok daratan  mainland china  melaporkan       kasus baru infeksi covid     peningkatan tertinggi sejak awal pandemi  hanya       kasus merupakan kasus konfirmasi bergejala covid     sisanya tidak bergejala dengan sebagian besar kasus berasal dari shanghai ,https://twitter.com/GoodDoggo107/status/1508615559595712514,"[('tiongkok', 'n'), ('daratan', 'n'), ('mainland', 'n'), ('china', 'n'), ('melaporkan', None), ('infeksi', 'n'), ('covid', 'n'), ('peningkatan', 'n'), ('tertinggi', 'n'), ('pandemi', 'n'), ('konfirmasi', 'n'), ('bergejala', 'n'), ('covid', 'n'), ('sisanya', 'n'), ('bergejala', 'n'), ('berasal', 'n'), ('shanghai', 'n')]",FAKTA
1647916822000.0,2022-03-22 09:40:22,1137722304043995137,ArdinalRais,🇲🇨#JohnWick007🇵🇸🇷🇺,rusia menemukan bahan pembuat covid     yakni zat patogen kelelawar  disebuah laboratorium amerika serikat di ukraina  penemuan tersebut menimbulkan kebingungan dunia pasalnya  selama ini covid    dicurigai berasal dari sebuah laboratorium di wuhan china     ,https://twitter.com/ArdinalRais/status/1506098432435699715,"[('rusia', 'n'), ('menemukan', 'n'), ('bahan', 'n'), ('pembuat', 'n'), ('covid', 'n'), ('zat', 'n'), ('patogen', 'n'), ('kelelawar', 'v'), ('disebuah', None), ('laboratorium', 'n'), ('amerika', None), ('serikat', 'n'), ('ukraina', None), ('penemuan', 'n'), ('menimbulkan', 'n'), ('kebingungan', 'v'), ('dunia', None), ('pasalnya', 'n'), ('covid', 'n'), ('dicurigai', 'n'), ('berasal', 'n'), ('laboratorium', 'n'), ('wuhan', None), ('china', 'n')]",FAKTA
1647013381000.0,2022-03-11 22:43:01,594431680,KopiLuwakSby,KOPI LUWAK original, skg ketahuan deh covid    bio weapon barat faktanya berasal dari amerika  china hanya jd kambing hitam ,https://twitter.com/KopiLuwakSby/status/1502309124675014656,"[('skg', None), ('ketahuan', 'n'), ('deh', 'n'), ('covid', 'n'), ('bio', 'n'), ('weapon', None), ('barat', 'n'), ('faktanya', 'n'), ('berasal', 'n'), ('amerika', None), ('china', 'n'), ('jd', 'n'), ('kambing', 'v'), ('hitam', 'n')]",FAKTA
1645958874000.0,2022-02-27 17:47:54,1300615030514356233,ckltvanila,eM,  lah yg nyenggol emng siapa  gaada yg nyebut china malihh  yg ada noh temen lu yang tbtb nimbrung mana oot banget lagi  gak sadar apa kalo covid berasal dari china  kok pede banget ngetik kayak gitu ,https://twitter.com/ckltvanila/status/1497886200702840834,"[('yg', 'n'), ('nyenggol', None), ('emng', 'n'), ('gaada', 'n'), ('yg', 'n'), ('nyebut', None), ('china', 'n'), ('malihh', 'n'), ('yg', 'n'), ('noh', None), ('temen', 'n'), ('lu', 'v'), ('tbtb', None), ('nimbrung', 'n'), ('oot', 'v'), ('banget', 'v'), ('gak', 'n'), ('sadar', 'n'), ('kalo', 'n'), ('covid', 'n'), ('berasal', 'n'), ('china', 'n'), ('pede', 'n'), ('banget', 'n'), ('ngetik', None), ('kayak', 'n'), ('gitu', 'n')]",FAKTA
1645958496000.0,2022-02-27 17:41:36,1163847335467577344,taeluvv30,Fitriani - (kinda ia),bukan nya covid berasal dari china dah ni mba nya ada masalah apa si sama hidupnya,https://twitter.com/taeluvv30/status/1497884616501334016,"[('nya', 'n'), ('covid', 'n'), ('berasal', 'n'), ('china', 'n'), ('dah', 'n'), ('ni', None), ('mba', 'n'), ('nya', None), ('si', 'n'), ('hidupnya', 'n')]",FAKTA
1645956490000.0,2022-02-27 17:08:10,1329985835991646208,__babymy,AMIROG\PROOF/,  t ttapii kan emang orang china makan kelelawar ga sih  makannya ada covid yang berasal dari china,https://twitter.com/__babymy/status/1497876200995180546,"[('t', 'n'), ('ttapii', 'n'), ('emang', 'n'), ('orang', None), ('china', 'n'), ('makan', None), ('kelelawar', None), ('ga', 'n'), ('sih', 'n'), ('makannya', 'n'), ('covid', 'n'), ('berasal', 'n'), ('china', 'n')]",FAKTA
1659133936000.0,2022-07-30 05:32:16,1288741435332677632,Lantasresblw,satlantaspolrespelabuhanbelawan,kegiatan rutin yang ditingkatkan sat lantas polres pel blwn melaksanakan sosialisasi   peraturan berlalu lintas dan penerapan prokes serta menghimbau kepada masyarakat dan para pengguna jalan agar melaksanakan vaksin dan mencegah penyebaran wabah covid      ,https://twitter.com/Lantasresblw/status/1553146417279291392,"[('kegiatan', 'n'), ('rutin', 'n'), ('ditingkatkan', 'n'), ('sat', 'v'), ('lantas', None), ('polres', 'n'), ('pel', 'v'), ('blwn', None), ('melaksanakan', 'n'), ('sosialisasi', 'n'), ('peraturan', 'n'), ('lintas', None), ('penerapan', 'n'), ('prokes', 'n'), ('menghimbau', None), ('masyarakat', 'n'), ('pengguna', 'n'), ('jalan', 'n'), ('melaksanakan', None), ('vaksin', 'n'), ('mencegah', 'n'), ('penyebaran', 'n'), ('wabah', 'n'), ('covid', 'n')]",FAKTA
1659075925000.0,2022-07-29 13:25:25,1356456322716286976,mraldy13,mraldy,manfaat vaksin booster  dokter  untuk mencegah gejala berat dan long covid    booster lindungi diri  ,https://twitter.com/mraldy13/status/1552903102944010240,"[('manfaat', 'n'), ('vaksin', 'n'), ('booster', 'n'), ('dokter', 'n'), ('mencegah', 'n'), ('gejala', 'n'), ('berat', 'n'), ('long', 'r'), ('covid', None), ('booster', 'n'), ('lindungi', 'n')]",FAKTA
1659075655000.0,2022-07-29 13:20:55,1449326107107282950,uta41768366,Dewi Utari,jika memang vaksin cacar bisa mencegah cacar monyet  apa tidak sebaiknya vaksinasi cacar diutamakan ke masyarakat daripada boster ke   vaksin covid    ,https://twitter.com/uta41768366/status/1552901967353380865,"[('vaksin', 'n'), ('cacar', 'n'), ('mencegah', 'n'), ('cacar', 'n'), ('monyet', 'r'), ('vaksinasi', 'n'), ('cacar', 'n'), ('diutamakan', 'n'), ('masyarakat', 'n'), ('boster', 'n'), ('vaksin', 'n'), ('covid', 'n')]",FAKTA
1659072397000.0,2022-07-29 12:26:37,235458355,aiistwts,aulia ika i,nanti juga dia bakal vaksin covid juga insyaallah  kenapa vaksinnya buanyak  ya emang penyakitnya buanyak  lek aku se lebih baik mencegah daripada mengobati ,https://twitter.com/aiistwts/status/1552888302881370118,"[('vaksin', 'n'), ('covid', 'n'), ('insyaallah', 'n'), ('vaksinnya', 'n'), ('buanyak', 'n'), ('ya', 'n'), ('emang', 'v'), ('penyakitnya', None), ('buanyak', 'n'), ('lek', 'n'), ('mencegah', 'n'), ('mengobati', 'n')]",FAKTA
1659071384000.0,2022-07-29 12:09:44,1145552937961177090,PklHumas,Humas Polsek Pkl. Susu,kegiatan   kasium polsek pangkalan susu aiptu sugiharto melaksanakan kegiatan monitoring vaksin untuk masyarakat umum di upt puskesmas pkl  susu sehingga masyarakat dapat mencegah penyebaran covid      ,https://twitter.com/PklHumas/status/1552884055058059265,"[('kegiatan', None), ('kasium', 'n'), ('polsek', 'n'), ('pangkalan', 'n'), ('susu', 'v'), ('aiptu', None), ('sugiharto', 'n'), ('melaksanakan', None), ('kegiatan', 'n'), ('monitoring', 'n'), ('vaksin', 'n'), ('masyarakat', 'n'), ('upt', None), ('puskesmas', 'n'), ('pkl', 'n'), ('susu', 'n'), ('masyarakat', 'n'), ('mencegah', 'n'), ('penyebaran', 'n'), ('covid', 'n')]",FAKTA
1659069389000.0,2022-07-29 11:36:29,4756031396,YDarmokoesumo,seeYen, jika tak mampu mencegah penularan  bukan berarti vaksin covid    lantas tak efektif  terbukti  vaksinasi booster bisa mengurangi risiko kematian covid    hingga    persen berdasarkan data kemenkes ri ,https://twitter.com/YDarmokoesumo/status/1552875688008777728,"[('mencegah', 'n'), ('penularan', 'n'), ('vaksin', 'n'), ('covid', 'n'), ('lantas', 'n'), ('efektif', None), ('terbukti', 'n'), ('vaksinasi', 'n'), ('booster', 'n'), ('mengurangi', 'n'), ('risiko', 'n'), ('kematian', None), ('covid', 'n'), ('persen', 'v'), ('berdasarkan', 'n'), ('data', 'n'), ('kemenkes', 'n'), ('ri', 'v')]",FAKTA
1659068618000.0,2022-07-29 11:23:38,912850970,SuryadiGatot,No Name,katanya vaksin fucksin mencegah keparahan   mencegah kematian kalau kena covid    kok  ,https://twitter.com/SuryadiGatot/status/1552872451909988353,"[('vaksin', 'n'), ('fucksin', 'n'), ('mencegah', 'n'), ('keparahan', 'n'), ('mencegah', 'n'), ('kematian', None), ('kena', 'n'), ('covid', 'n')]",FAKTA
1659067388000.0,2022-07-29 11:03:08,1288741435332677632,Lantasresblw,satlantaspolrespelabuhanbelawan,kegiatan rutin yang ditingkatkan sat lantas polres pel blwn melaksanakan sosialisasi   peraturan berlalu lintas dan penerapan prokes serta menghimbau kepada masyarakat dan para pengguna jalan agar melaksanakan vaksin dan mencegah penyebaran wabah covid      ,https://twitter.com/Lantasresblw/status/1552867295411974146,"[('kegiatan', 'n'), ('rutin', 'n'), ('ditingkatkan', 'n'), ('sat', 'v'), ('lantas', None), ('polres', 'n'), ('pel', 'v'), ('blwn', None), ('melaksanakan', 'n'), ('sosialisasi', 'n'), ('peraturan', 'n'), ('lintas', None), ('penerapan', 'n'), ('prokes', 'n'), ('menghimbau', None), ('masyarakat', 'n'), ('pengguna', 'n'), ('jalan', 'n'), ('melaksanakan', None), ('vaksin', 'n'), ('mencegah', 'n'), ('penyebaran', 'n'), ('wabah', 'n'), ('covid', 'n')]",FAKTA
1659063394000.0,2022-07-29 09:56:34,1431844927961387010,Lantas_Sergai,SAT LANTAS POLRES SERGAI,ayo vaksin dan patuhi prokes dalam kehidupan sehari hari  untuk mencegah penularan virus covid     pandemibelumberakhir  patuhiprotokolkesehatan  ingat m  bersatulawancovid    ,https://twitter.com/Lantas_Sergai/status/1552850542875267073,"[('ayo', 'n'), ('vaksin', 'n'), ('patuhi', 'n'), ('prokes', 'n'), ('kehidupan', 'v'), ('sehari', None), ('mencegah', 'n'), ('penularan', 'n'), ('virus', 'n'), ('covid', 'n'), ('pandemibelumberakhir', 'n'), ('patuhiprotokolkesehatan', 'n'), ('m', 'n'), ('bersatulawancovid', 'n')]",FAKTA
1659061570000.0,2022-07-29 09:26:10,1460032430245654531,AdrienPdkrUtr,Adrien, vaksin booster guna mencegah penyebaran covid     booster lindungi diri,https://twitter.com/AdrienPdkrUtr/status/1552842892376698880,"[('vaksin', 'n'), ('booster', 'n'), ('mencegah', 'n'), ('penyebaran', 'n'), ('covid', 'n'), ('booster', 'n'), ('lindungi', 'n')]",FAKTA
1659058201000.0,2022-07-29 08:30:01,2890721762,LINIKINI_ID,LINIKINI_ID,yeay  udah ada vaksin booster kedua nih  commuters   tapi dosis keempat ini  lebih diutamakan buat tenaga kesehatan ri yang lagi berjuang ngerawat pasien covid    ya   untuk mencegah tingginya kasus tersebut  jangan lupa selalu patuhi prokes yang ada   source   ,https://twitter.com/LINIKINI_ID/status/1552828761921695744,"[('yeay', 'n'), ('udah', None), ('vaksin', 'n'), ('booster', 'n'), ('nih', None), ('commuters', 'n'), ('dosis', 'n'), ('keempat', 'n'), ('diutamakan', 'n'), ('tenaga', 'n'), ('kesehatan', 'n'), ('ri', 'n'), ('berjuang', 'n'), ('ngerawat', None), ('pasien', 'n'), ('covid', 'n'), ('ya', 'n'), ('mencegah', 'n'), ('tingginya', 'n'), ('lupa', None), ('patuhi', 'n'), ('prokes', 'n'), ('source', 'n')]",FAKTA
1658996880000.0,2022-07-28 15:28:00,825945728858021889,pemkot_salatiga,Pemkot Salatiga #salatigasatujua,sedulursalatiga  pemerintah terus melakukan cara untuk mencegah dan menanggulangi covid     salah satunya adalah dengan pelaksanaan vaksin dosis lanjutan  booster   penerapan kebijakan baru ini dilatarbelakangi oleh capaian vaksinasi booster yang masih rendah   vaksinbooster  ,https://twitter.com/pemkot_salatiga/status/1552571562632826880,"[('sedulursalatiga', 'n'), ('pemerintah', 'n'), ('mencegah', 'n'), ('menanggulangi', 'n'), ('covid', 'n'), ('salah', 'n'), ('satunya', 'n'), ('pelaksanaan', None), ('vaksin', 'n'), ('dosis', 'n'), ('lanjutan', None), ('booster', 'n'), ('penerapan', 'n'), ('kebijakan', 'v'), ('dilatarbelakangi', 'n'), ('capaian', None), ('vaksinasi', 'n'), ('booster', 'n'), ('rendah', 'n'), ('vaksinbooster', 'n')]",FAKTA
1658992440000.0,2022-07-28 14:14:00,241936971,FitRadioBandung,94.8 FM FIT Radio Bandung,jika pandemi covid    masih berlanjut  pemerintah merencakan vaksinasi booster kedua sebagai penguat antibodi   meski tidak mencegah penularan  vaksin terbukti ampuh untuk melawan risiko bergejala berat dan mengurangi risiko perawatan di rumah sakit   staysafe stayfitforlife  ,https://twitter.com/FitRadioBandung/status/1552552938442203138,"[('pandemi', 'n'), ('covid', 'n'), ('berlanjut', 'n'), ('pemerintah', 'n'), ('merencakan', 'n'), ('vaksinasi', 'n'), ('booster', 'n'), ('penguat', 'n'), ('antibodi', 'n'), ('mencegah', 'n'), ('penularan', 'n'), ('vaksin', 'n'), ('terbukti', 'n'), ('ampuh', 'n'), ('melawan', 'n'), ('risiko', 'n'), ('bergejala', 'n'), ('berat', 'n'), ('mengurangi', 'n'), ('risiko', 'n'), ('perawatan', 'n'), ('rumah', 'n'), ('sakit', 'n'), ('staysafe', None), ('stayfitforlife', 'n')]",FAKTA
1658988093000.0,2022-07-28 13:01:33,1413420284539928579,RezaAjj31399949,Reza Ajja,manfaat vaksin booster  dokter  untuk mencegah gejala berat dan long covid    prokes lengkapi booster  ,https://twitter.com/RezaAjj31399949/status/1552534706331078656,"[('manfaat', 'n'), ('vaksin', 'n'), ('booster', 'n'), ('dokter', 'n'), ('mencegah', 'n'), ('gejala', 'n'), ('berat', 'n'), ('long', 'r'), ('covid', None), ('prokes', 'n'), ('lengkapi', 'v'), ('booster', 'n')]",FAKTA
1658988031000.0,2022-07-28 13:00:31,1356692433984126976,EkaSilawati2,Eka Silawati,manfaat vaksin booster  dokter  untuk mencegah gejala berat dan long covid    prokes lengkapi booster  ,https://twitter.com/EkaSilawati2/status/1552534448968978432,"[('manfaat', 'n'), ('vaksin', 'n'), ('booster', 'n'), ('dokter', 'n'), ('mencegah', 'n'), ('gejala', 'n'), ('berat', 'n'), ('long', 'r'), ('covid', None), ('prokes', 'n'), ('lengkapi', 'v'), ('booster', 'n')]",FAKTA
1658985354000.0,2022-07-28 12:15:54,1145552937961177090,PklHumas,Humas Polsek Pkl. Susu,kegiatan kanit binmas polsek pangkalan susu aipda tarmadi rahanto  amp  aipda joko irmansyah melaksanakan kegiatan monitoring vaksin masal untuk masyarakat umum di upt puskesmas pkl  susu sehingga masyarakat dapat mencegah penyebaran covid      ,https://twitter.com/PklHumas/status/1552523220531957760,"[('kegiatan', 'n'), ('kanit', 'v'), ('binmas', None), ('polsek', 'n'), ('pangkalan', 'n'), ('susu', 'v'), ('aipda', None), ('tarmadi', 'n'), ('rahanto', 'n'), ('amp', 'n'), ('aipda', 'n'), ('joko', 'n'), ('irmansyah', 'n'), ('melaksanakan', None), ('kegiatan', 'n'), ('monitoring', 'n'), ('vaksin', 'n'), ('masal', 'n'), ('masyarakat', 'n'), ('upt', None), ('puskesmas', 'n'), ('pkl', 'n'), ('susu', 'n'), ('masyarakat', 'n'), ('mencegah', 'n'), ('penyebaran', 'n'), ('covid', 'n')]",FAKTA
1658984598000.0,2022-07-28 12:03:18,1413384274376491014,IndonesiaSht,Indonesia Sehat,vaksin covid    teruji dan terbukti mencegah penularan varian baru covid      prokes lengkapi booster  ,https://twitter.com/IndonesiaSht/status/1552520048660869123,"[('vaksin', 'n'), ('covid', 'n'), ('teruji', 'n'), ('terbukti', 'n'), ('mencegah', 'n'), ('penularan', 'n'), ('varian', None), ('covid', 'n'), ('prokes', 'n'), ('lengkapi', 'v'), ('booster', 'n')]",FAKTA
1658984595000.0,2022-07-28 12:03:15,1413384274376491014,IndonesiaSht,Indonesia Sehat,vaksin covid    teruji dan terbukti mencegah penularan varian baru covid      prokes lengkapi booster  ,https://twitter.com/IndonesiaSht/status/1552520033284550657,"[('vaksin', 'n'), ('covid', 'n'), ('teruji', 'n'), ('terbukti', 'n'), ('mencegah', 'n'), ('penularan', 'n'), ('varian', None), ('covid', 'n'), ('prokes', 'n'), ('lengkapi', 'v'), ('booster', 'n')]",FAKTA
1658982992000.0,2022-07-28 11:36:32,1549651939016982529,KrissBee12,Kriss Bee,manfaat vaksin booster  mencegah gejala berat dan long covid     prokes lengkapi booster,https://twitter.com/KrissBee12/status/1552513313149714433,"[('manfaat', 'n'), ('vaksin', 'n'), ('booster', 'n'), ('mencegah', 'n'), ('gejala', 'n'), ('berat', 'n'), ('long', 'r'), ('covid', None), ('prokes', 'n'), ('lengkapi', 'v'), ('booster', 'n')]",FAKTA
1658979874000.0,2022-07-28 10:44:34,1091038500,SAIFULDINDUNGUN,SAIFULDINDUNGUN,manfaat vaksin booster  dokter  untuk mencegah gejala berat dan long covid    prokes lengkapi booster  ,https://twitter.com/SAIFULDINDUNGUN/status/1552500233812078592,"[('manfaat', 'n'), ('vaksin', 'n'), ('booster', 'n'), ('dokter', 'n'), ('mencegah', 'n'), ('gejala', 'n'), ('berat', 'n'), ('long', 'r'), ('covid', None), ('prokes', 'n'), ('lengkapi', 'v'), ('booster', 'n')]",FAKTA
1658978587000.0,2022-07-28 10:23:07,23343960,kompascom,Kompas.com,vaksin covid    astrazeneca  azd      sebagai booster dosis krempat terbukti efektif dalam mencegah infeksi covid    akibat omicron   ,https://twitter.com/kompascom/status/1552494835658940416,"[('vaksin', 'n'), ('covid', 'n'), ('astrazeneca', 'n'), ('azd', 'n'), ('booster', 'n'), ('dosis', 'n'), ('krempat', 'n'), ('terbukti', 'n'), ('efektif', None), ('mencegah', 'n'), ('infeksi', 'n'), ('covid', 'n'), ('akibat', 'n'), ('omicron', 'n')]",FAKTA
