created_at,date,user_id,username,name,tweet,link,tweet_preproc
1657192812000.0,2022-07-07 18:20:12,1414514521033515013,AbimayuHadiyata,Abimayu Hadiyata,keren semoga kasus covid bisa membaik setelah banyak yang sudah di vaksin booster lazada mid year sale,https://twitter.com/AbimayuHadiyata/status/1545004752689238016,"['keren', 'moga', 'kasus', 'covid', 'bisa', 'baik', 'telah', 'banyak', 'yang', 'sudah', 'di', 'vaksin', 'booster', 'lazada', 'mid', 'year', 'sale']"
1654511200000.0,2022-06-06 17:26:40,1464177731806154752,QuindraViana,Vianaaaaa,haechan ultah tapi ternyata malah kena covid btw penasaran deh korea kan negara maju kenapa kasus covidnya masih banyak sampai skrg ya indonesia justru lebih dulu membaik konser fansnya teriak jg sudah boleh disini,https://twitter.com/QuindraViana/status/1533757257162190850,"['haechan', 'ultah', 'tapi', 'nyata', 'malah', 'kena', 'covid', 'btw', 'penasaran', 'deh', 'korea', 'kan', 'negara', 'maju', 'kenapa', 'kasus', 'covidnya', 'masih', 'banyak', 'sampai', 'sekarang', 'ya', 'indonesia', 'justru', 'lebih', 'dulu', 'baik', 'konser', 'fansnya', 'teriak', 'juga', 'sudah', 'boleh', 'sini']"
1654510317000.0,2022-06-06 17:11:57,1256115929923981317,perupadata,perupadata,provinsi menyumbang kasus harian covid sebanyak turun dibanding kemarin dengan tes yang juga membaik sayangnya kasus aktif masih terus naik sudah hari ini,https://twitter.com/perupadata/status/1533753554929741824,"['provinsi', 'sumbang', 'kasus', 'hari', 'covid', 'banyak', 'turun', 'banding', 'kemarin', 'dengan', 'tes', 'yang', 'juga', 'baik', 'sayang', 'kasus', 'aktif', 'masih', 'terus', 'naik', 'sudah', 'hari', 'ini']"
1653943278000.0,2022-05-31 03:41:18,1327869890322055168,BangTAJIR8,Julia Kristin,pk rizam kasus covid sudah membaik kenapa pilkada dki harus di tunda apa urgensinya solo aja jalan terus walau covid merebak kemana mana cc ri,https://twitter.com/BangTAJIR8/status/1531375217683025920,"['pk', 'rizam', 'kasus', 'covid', 'sudah', 'baik', 'kenapa', 'pilkada', 'dki', 'harus', 'di', 'tunda', 'apa', 'urgensi', 'solo', 'aja', 'jalan', 'terus', 'walau', 'covid', 'rebak', 'mana', 'mana', 'cc', 'ri']"
1653464043000.0,2022-05-25 14:34:03,23343960,kompascom,Kompas.com,lebih lanjut zubairi menyarankan masyarakat untuk tetap memakai masker meski kasus covid sudah membaik,https://twitter.com/kompascom/status/1529365163509305345,"['lebih', 'lanjut', 'zubairi', 'saran', 'masyarakat', 'untuk', 'tetap', 'pakai', 'masker', 'meski', 'kasus', 'covid', 'sudah', 'baik']"
1652963230000.0,2022-05-19 19:27:10,69183155,detikcom,detikcom,di tengah tren kasus covid di indonesia yang mulai membaik sudah ada wilayah nihil kasus berikut daftar lengkapnya,https://twitter.com/detikcom/status/1527264598344314886,"['di', 'tengah', 'tren', 'kasus', 'covid', 'di', 'indonesia', 'yang', 'mulai', 'baik', 'sudah', 'ada', 'wilayah', 'nihil', 'kasus', 'ikut', 'daftar', 'lengkap']"
1652961107000.0,2022-05-19 18:51:47,104446991,detikHealth,detikHealth,di tengah tren kasus covid di indonesia yang mulai membaik sudah ada wilayah nihil kasus berikut daftar lengkapnya,https://twitter.com/detikHealth/status/1527255696412221441,"['di', 'tengah', 'tren', 'kasus', 'covid', 'di', 'indonesia', 'yang', 'mulai', 'baik', 'sudah', 'ada', 'wilayah', 'nihil', 'kasus', 'ikut', 'daftar', 'lengkap']"
1651656775000.0,2022-05-04 16:32:55,153407983,PDI_Perjuangan,PDI Perjuangan,perkembangan pandemi covid di bali sudah terus membaik hal ini terlihat dari data kumulatif sampai april jumlah kasus baru mengalami penurunan secara konsisten melandai dan stabil pada angka dua digit yang rendah antara sampai orang per hari,https://twitter.com/PDI_Perjuangan/status/1521784932426690563,"['kembang', 'pandemi', 'covid', 'di', 'bal', 'sudah', 'terus', 'baik', 'hal', 'ini', 'lihat', 'dari', 'data', 'kumulatif', 'sampai', 'april', 'jumlah', 'kasus', 'baru', 'alami', 'turun', 'cara', 'konsisten', 'landai', 'dan', 'stabil', 'pada', 'angka', 'dua', 'digit', 'yang', 'rendah', 'antara', 'sampai', 'orang', 'per', 'hari']"
1650698477000.0,2022-04-23 14:21:17,142305302,tribunmedan,Tribun Medan,akan tetapi akibat pandemi yang terjadi layanan ini tidak dilaksanakan sementara demi mencegah penyebaran covid saat ini jumlah kasus covid sudah mulai melandai dan kondisi nasional terus membaik baca selengkapnya di,https://twitter.com/tribunmedan/status/1517765538407411712,"['akan', 'tetapi', 'akibat', 'pandemi', 'yang', 'jadi', 'layan', 'ini', 'tidak', 'laksana', 'sementara', 'demi', 'cegah', 'sebar', 'covid', 'saat', 'ini', 'jumlah', 'kasus', 'covid', 'sudah', 'mulai', 'landai', 'dan', 'kondisi', 'nasional', 'terus', 'baik', 'baca', 'lengkap', 'di']"
1650697254000.0,2022-04-23 14:00:54,1150280984,kanimsus_medan,imigrasi_medan,akan tetapi akibat pandemi yang terjadi layanan ini tidak dilaksanakan sementara demi mencegah penyebaran covid saat ini jumlah kasus covid sudah mulai melandai dan kondisi nasional terus membaik baca selengkapnya di,https://twitter.com/kanimsus_medan/status/1517760407536308224,"['akan', 'tetapi', 'akibat', 'pandemi', 'yang', 'jadi', 'layan', 'ini', 'tidak', 'laksana', 'sementara', 'demi', 'cegah', 'sebar', 'covid', 'saat', 'ini', 'jumlah', 'kasus', 'covid', 'sudah', 'mulai', 'landai', 'dan', 'kondisi', 'nasional', 'terus', 'baik', 'baca', 'lengkap', 'di']"
1650250975000.0,2022-04-18 10:02:55,3071562996,officialumntv,UMN TV,share your thoughts ultimates melihat kasus covid yang terus membaik menko luhut binsar panjaitan mengumumkan bahwa sekarang naik pesawat untuk penerbangan domestik tidak perlu lagi pcr dengan syarat sudah lengkap vaksin dosis ke,https://twitter.com/officialumntv/status/1515888576550293505,"['share', 'your', 'thoughts', 'ultimates', 'lihat', 'kasus', 'covid', 'yang', 'terus', 'baik', 'menko', 'luhut', 'binsar', 'panjaitan', 'umum', 'bahwa', 'sekarang', 'naik', 'pesawat', 'untuk', 'terbang', 'domestik', 'tidak', 'perlu', 'lagi', 'pcr', 'dengan', 'syarat', 'sudah', 'lengkap', 'vaksin', 'dosis', 'ke']"
1648562237000.0,2022-03-29 20:57:17,153407983,PDI_Perjuangan,PDI Perjuangan,menurutnya keputusan yang diambil oleh pemerintah kota kediri sudah benar itu sudah bagus memang sekarang ini kasus covid sudah berangsurangsur membaik dan sudah bisa diatasi,https://twitter.com/PDI_Perjuangan/status/1508805497872617473,"['turut', 'putus', 'yang', 'ambil', 'oleh', 'perintah', 'kota', 'diri', 'sudah', 'benar', 'itu', 'sudah', 'bagus', 'memang', 'sekarang', 'ini', 'kasus', 'covid', 'sudah', 'berangsurangsur', 'baik', 'dan', 'sudah', 'bisa', 'atas']"
1648116844000.0,2022-03-24 17:14:04,1256115929923981317,perupadata,perupadata,ribu kasus baru covid dengan positivity rate berangsutmembaik tren hari ini masih berlanjut jakarta dan jawa barat catatkan seribuan kasus baru sementara provinsi lain di atas seribu bahkan ada yang sudah satu digit kasus aktif masih terus konsisten turun,https://twitter.com/perupadata/status/1506937383953989640,"['ribu', 'kasus', 'baru', 'covid', 'dengan', 'positivity', 'rate', 'berangsutmembaik', 'tren', 'hari', 'ini', 'masih', 'lanjut', 'jakarta', 'dan', 'jawa', 'barat', 'catat', 'ribu', 'kasus', 'baru', 'sementara', 'provinsi', 'lain', 'di', 'atas', 'ribu', 'bahkan', 'ada', 'yang', 'sudah', 'satu', 'digit', 'kasus', 'aktif', 'masih', 'terus', 'konsisten', 'turun']"
1648092091000.0,2022-03-24 10:21:31,1258026281486057476,subroto_aldo,Aldo Subroto Pamudji,kasus covid di indonesia sudah mulai membaik percepat vaksin dan lakukan vaksinasi bosster,https://twitter.com/subroto_aldo/status/1506833563328557056,"['kasus', 'covid', 'di', 'indonesia', 'sudah', 'mulai', 'baik', 'cepat', 'vaksin', 'dan', 'laku', 'vaksinasi', 'bosster']"
1648076401000.0,2022-03-24 06:00:01,1388737982769754123,Febrian40728473,Febrianto,perkembangan kasus covid di indonesia sudah mulai terus membaik,https://twitter.com/Febrian40728473/status/1506767753494994944,"['kembang', 'kasus', 'covid', 'di', 'indonesia', 'sudah', 'mulai', 'terus', 'baik']"
1646816460000.0,2022-03-09 16:01:00,241936971,FitRadioBandung,94.8 FM FIT Radio Bandung,satgas penanganan covid menyebut puncak gelombang ketiga corona akibat varian omicron di indonesia sudah terlewati ini terlihat dari kasus positif yang terus menurun dan beberapa indikator yang menunjukkan tren semakin membaik,https://twitter.com/FitRadioBandung/status/1501483177151385604,"['satgas', 'tangan', 'covid', 'sebut', 'puncak', 'gelombang', 'tiga', 'corona', 'akibat', 'varian', 'omicron', 'di', 'indonesia', 'sudah', 'lewat', 'ini', 'lihat', 'dari', 'kasus', 'positif', 'yang', 'terus', 'turun', 'dan', 'beberapa', 'indikator', 'yang', 'tunjuk', 'tren', 'makin', 'baik']"
1645684374000.0,2022-02-24 13:32:54,1484229323750256641,trex4457,T-Rex,covid sudah membaik walaupun kasus ningkat tapi imun manusia udah mulai kuat melawan covid maka nya sekarang ini new normal udah gak lockdown di seluruh dunia,https://twitter.com/trex4457/status/1496734866418769924,"['covid', 'sudah', 'baik', 'walaupun', 'kasus', 'ningkat', 'tapi', 'imun', 'manusia', 'udah', 'mulai', 'kuat', 'lawan', 'covid', 'maka', 'nya', 'sekarang', 'ini', 'new', 'normal', 'udah', 'tidak', 'lockdown', 'di', 'seluruh', 'dunia']"
1644291110000.0,2022-02-08 10:31:50,2338126526,fauzann232,Fauzan7, iyaa pak kalo di lihat kemarin mereka malah minta cabut darurat pandemi covid tujuannya kelihatan ingin menggagalkan upaya pemerintah untuk melawan pandemi yg sudah mulai membaik kalau kasus meningkat mereka juga gak tanggung jawab yang di salahkan pemerintah lagi,https://twitter.com/fauzann232/status/1490891092660682756,"['iyaa', 'pak', 'kalau', 'di', 'lihat', 'kemarin', 'mereka', 'malah', 'minta', 'cabut', 'darurat', 'pandemi', 'covid', 'tuju', 'lihat', 'ingin', 'gagal', 'upaya', 'perintah', 'untuk', 'lawan', 'pandemi', 'yang', 'sudah', 'mulai', 'baik', 'kalau', 'kasus', 'tingkat', 'mereka', 'juga', 'tidak', 'tanggung', 'jawab', 'yang', 'di', 'salah', 'perintah', 'lagi']"
1644287634000.0,2022-02-08 09:33:54,2338126526,fauzann232,Fauzan7,iyaa pak kalo di lihat kemarin mereka malah minta cabut darurat pandemi covid tujuannya kelihatan ingin menggagalkan upaya pemerintah untuk melawan pandemi yg sudah mulai membaik kalau kasus meningkat mereka juga gak tanggung jawab yang di salahkan pemerintah lagi,https://twitter.com/fauzann232/status/1490876513301893122,"['iyaa', 'pak', 'kalau', 'di', 'lihat', 'kemarin', 'mereka', 'malah', 'minta', 'cabut', 'darurat', 'pandemi', 'covid', 'tuju', 'lihat', 'ingin', 'gagal', 'upaya', 'perintah', 'untuk', 'lawan', 'pandemi', 'yang', 'sudah', 'mulai', 'baik', 'kalau', 'kasus', 'tingkat', 'mereka', 'juga', 'tidak', 'tanggung', 'jawab', 'yang', 'di', 'salah', 'perintah', 'lagi']"
1643892052000.0,2022-02-03 19:40:52,874171254122496000,DitjenAnggaran,Direktorat Jenderal Anggaran,nilai neraca perdagangan yang surplus ini juga bisa menjadi pertanda bahwa perekonomian suatu negara sudah berlangsung dan membaik lho namun potensi risiko akibat kasus covid kondisi ekonomi dan geopolitik global masih ada,https://twitter.com/DitjenAnggaran/status/1489217322724167680,"['nilai', 'neraca', 'dagang', 'yang', 'surplus', 'ini', 'juga', 'bisa', 'jadi', 'tanda', 'bahwa', 'ekonomi', 'suatu', 'negara', 'sudah', 'langsung', 'dan', 'baik', 'lho', 'namun', 'potensi', 'risiko', 'akibat', 'kasus', 'covid', 'kondisi', 'ekonomi', 'dan', 'geopolitik', 'global', 'masih', 'ada']"
1640260191000.0,2021-12-23 18:49:51,538759871,Evi_Fadliah,Evi Fadliah ◡̈,well we know kondisi di indonesia saat ini sudah semakin membaik tapi yang namanya virus covid masih ajah cari celah jangan sampai niy kasus omicron di indonesia semakin bertambah makanya please ya libur natarunya di rumah aja dulu,https://twitter.com/Evi_Fadliah/status/1473984193080090624,"['well', 'we', 'know', 'kondisi', 'di', 'indonesia', 'saat', 'ini', 'sudah', 'makin', 'baik', 'tapi', 'yang', 'nama', 'virus', 'covid', 'masih', 'ajah', 'cari', 'celah', 'jangan', 'sampai', 'niy', 'kasus', 'omicron', 'di', 'indonesia', 'makin', 'tambah', 'makanya', 'please', 'ya', 'libur', 'natarunya', 'di', 'rumah', 'aja', 'dulu']"
1640149832000.0,2021-12-22 12:10:32,18071520,antaranews,antaranews.com,meskipun situasi pandemi semakin membaik disiplin memakai masker harus tetap dijaga hal ini juga berlaku bagi yang sudah dua kali vaksinasi menyambut natal dan tahun baru kita batasi kegiatan agar mencegah lonjakan kasus kita harus tetap waspada karena covid masih ada,https://twitter.com/antaranews/status/1473521311762685953,"['meski', 'situasi', 'pandemi', 'makin', 'baik', 'disiplin', 'pakai', 'masker', 'harus', 'tetap', 'jaga', 'hal', 'ini', 'juga', 'laku', 'bagi', 'yang', 'sudah', 'dua', 'kali', 'vaksinasi', 'sambut', 'natal', 'dan', 'tahun', 'baru', 'kita', 'batas', 'giat', 'agar', 'cegah', 'lonjak', 'kasus', 'kita', 'harus', 'tetap', 'waspada', 'karena', 'covid', 'masih', 'ada']"
1639894330000.0,2021-12-19 13:12:10,980097559736721408,AlbertSolo2,Albert Solo,kasus omicron di belanda adalah salah satu yang tertinggi di eropa sudah ada warganya yang terkonfirmasi positif covid varian omicron dan sebagian besar sudah mulai membaik dan di ijinkan pulang untuk meredam omicron lebih luas lagi belanda berlakukan karantina ketat,https://twitter.com/AlbertSolo2/status/1472449661994561536,"['kasus', 'omicron', 'di', 'belanda', 'adalah', 'salah', 'satu', 'yang', 'tinggi', 'di', 'eropa', 'sudah', 'ada', 'warga', 'yang', 'konfirmasi', 'positif', 'covid', 'varian', 'omicron', 'dan', 'bagi', 'besar', 'sudah', 'mulai', 'baik', 'dan', 'di', 'ijinkan', 'pulang', 'untuk', 'redam', 'omicron', 'lebih', 'luas', 'lagi', 'belanda', 'laku', 'karantina', 'ketat']"
1639653000000.0,2021-12-16 18:10:00,1206371578444824579,jernihdotco,Jernih.co,meski kasus covid mulai mereda tetapi potensi penularan masih tetap ada oleh karenanya penanganan pandemi covid yang sudah membaik harus terus dijaga terutama saat libur nataru,https://twitter.com/jernihdotco/status/1471437447984607232,"['meski', 'kasus', 'covid', 'mulai', 'reda', 'tetapi', 'potensi', 'tular', 'masih', 'tetap', 'ada', 'oleh', 'karena', 'tangan', 'pandemi', 'covid', 'yang', 'sudah', 'baik', 'harus', 'terus', 'jaga', 'utama', 'saat', 'libur', 'nataru']"
1639543872000.0,2021-12-15 11:51:12,1424118408044367872,PuntoWicaksono,️Mas Pewe️,perketat deh jangan sampai kebobolan seperti kasuskasus sebelumnya pemerintah sudah baik menempuh jalan ini selama pandemi bahkan perekonomian indonesia sudah mulai membaik pasca varian covid yang sebelumnya,https://twitter.com/PuntoWicaksono/status/1470979734959898628,"['ketat', 'deh', 'jangan', 'sampai', 'bobol', 'seperti', 'kasuskasus', 'belum', 'perintah', 'sudah', 'baik', 'tempuh', 'jalan', 'ini', 'lama', 'pandemi', 'bahkan', 'ekonomi', 'indonesia', 'sudah', 'mulai', 'baik', 'pasca', 'varian', 'covid', 'yang', 'belum']"
1638766561000.0,2021-12-06 11:56:01,375034735,taeswooc,diana,india kasus covid naik lagi india open jadi kah tapi masih bulan depan sih semoga sudah membaik,https://twitter.com/taeswooc/status/1467719453177565184,"['india', 'kasus', 'covid', 'naik', 'lagi', 'india', 'open', 'jadi', 'kah', 'tapi', 'masih', 'bulan', 'depan', 'sih', 'moga', 'sudah', 'baik']"
1638181903000.0,2021-11-29 17:31:43,2467109641,infoppkk,Pusat Krisis Kesehatan Kemenkes RI,salam sehat saat ini situasi penanganan pandemi covid di indonesia semakin membaik tetapi bukan berarti pandemi sudah selesai hal berikut dapat memicu kenaikan kasus covid kembali simak selengkapnya berikut,https://twitter.com/infoppkk/status/1465267221106597894,"['salam', 'sehat', 'saat', 'ini', 'situasi', 'tangan', 'pandemi', 'covid', 'di', 'indonesia', 'makin', 'baik', 'tetapi', 'bukan', 'arti', 'pandemi', 'sudah', 'selesai', 'hal', 'ikut', 'dapat', 'picu', 'naik', 'kasus', 'covid', 'kembali', 'simak', 'lengkap', 'ikut']"
1637967601000.0,2021-11-27 06:00:01,1425620913165201410,HendraaM11,Hendra,dari penurunan kasus covid indonesia sudah berhasil dipertahankan hari semakin membaik,https://twitter.com/HendraaM11/status/1464368372943044610,"['dari', 'turun', 'kasus', 'covid', 'indonesia', 'sudah', 'hasil', 'tahan', 'hari', 'makin', 'baik']"
1637814951000.0,2021-11-25 11:35:51,109173947,tia_alzahira,Tia,ingat kan kasus libur panjang yang lalu dan bikin kelonjakan kasus covid sekarang kondisi sudah membaik terus disiplin prokes dan tunda dulu liburan,https://twitter.com/tia_alzahira/status/1463728114878402564,"['ingat', 'kan', 'kasus', 'libur', 'panjang', 'yang', 'lalu', 'dan', 'bikin', 'lonjak', 'kasus', 'covid', 'sekarang', 'kondisi', 'sudah', 'baik', 'terus', 'disiplin', 'prokes', 'dan', 'tunda', 'dulu', 'libur']"
1637136031000.0,2021-11-17 15:00:31,1216290368397836290,abi_sasaLL,abi sasal,perayaan harihari besar itulah muncul peningkatan kasus disebabkan oleh mobilitas dan pergerakan sangat tinggi kondisi sekarang sudah membaik bukan berarti kita sudah memenangkan peperangan covidtetap patuhi aturan dan terapkan prokes selalu,https://twitter.com/abi_sasaLL/status/1460880515343400969,"['raya', 'harihari', 'besar', 'itu', 'muncul', 'tingkat', 'kasus', 'sebab', 'oleh', 'mobilitas', 'dan', 'gera', 'sangat', 'tinggi', 'kondisi', 'sekarang', 'sudah', 'baik', 'bukan', 'arti', 'kita', 'sudah', 'menang', 'peperangan', 'covidtetap', 'patuh', 'atur', 'dan', 'terap', 'prokes', 'selalu']"
1637111322000.0,2021-11-17 08:08:42,1088295819617267713,PrasetyoEdi_,Prasetyo Edi Marsudi,untuk memutus mata rantai penyebaran virus korona walaupun kasus covid di tanah air sudah semakin menurun dan membaik alangkah lebih baiknya kita mengambil langkah preventif dengan tetap waspada dan jangan abai,https://twitter.com/PrasetyoEdi_/status/1460776877820243969,"['untuk', 'putus', 'mata', 'rantai', 'sebar', 'virus', 'korona', 'walaupun', 'kasus', 'covid', 'di', 'tanah', 'air', 'sudah', 'makin', 'turun', 'dan', 'baik', 'alangkah', 'lebih', 'baik', 'kita', 'ambil', 'langkah', 'preventif', 'dengan', 'tetap', 'waspada', 'dan', 'jangan', 'abai']"
1637061758000.0,2021-11-16 18:22:38,1036187530910027776,InfokomPMK,Informasi dan Komunikasi PMK,sobatkom kasus covid yang sudah berangsur membaik berdampak pada sektor industri yang mulai memberlakukan work from office wfo lho,https://twitter.com/InfokomPMK/status/1460568993769476098,"['sobatkom', 'kasus', 'covid', 'yang', 'sudah', 'angsur', 'baik', 'dampak', 'pada', 'sektor', 'industri', 'yang', 'mulai', 'laku', 'work', 'from', 'office', 'wfo', 'lho']"
1636992550000.0,2021-11-15 23:09:10,240099247,moonellaaaaa,Melva Surbakti,kalo keadaan perusahaan sudah membaik pasca kasus covid menurun management jgn pura buta dan tuli dong,https://twitter.com/moonellaaaaa/status/1460278712281165826,"['kalau', 'ada', 'usaha', 'sudah', 'baik', 'pasca', 'kasus', 'covid', 'turun', 'management', 'jangan', 'pura', 'buta', 'dan', 'tuli', 'dong']"
1636093706000.0,2021-11-05 13:28:26,1449930863135780867,HumasPolresBan5,Humas Polres Banjar,walaupun pengendalian kasus covid di indonesia sudah mulai membaik kapolri jenderal listyo sigit prabowo mengingatkan lagi pesan presiden joko widodo agar tidak lengah dan abai ciptakan herd immunity,https://twitter.com/HumasPolresBan5/status/1456508687908888577,"['walaupun', 'kendali', 'kasus', 'covid', 'di', 'indonesia', 'sudah', 'mulai', 'baik', 'kapolri', 'jenderal', 'listyo', 'sigit', 'prabowo', 'ingat', 'lagi', 'pesan', 'presiden', 'joko', 'widodo', 'agar', 'tidak', 'lengah', 'dan', 'abai', 'cipta', 'herd', 'immunity']"
